{
  "name": "synthesis",
  "version": "1.0.0",
  "description": "Synthesize final answer from retrieved chunks.",
  "inputs": {
    "original_query": { "type": "string", "required": true },
    "retrieved_chunks": { "type": "array", "required": true }
  },
  "outputs": {
    "final_response": { "type": "string" },
    "citations": { "type": "array" },
    "trace": { "type": "array" }
  },
  "execution": {
    "type": "python",
    "entrypoint": "app.graph.nodes:synthesis_agent"
  }
}
