{
  "name": "adequacy",
  "version": "1.0.0",
  "description": "Evaluate retrieval adequacy and abstention.",
  "inputs": {
    "original_query": { "type": "string", "required": true },
    "retrieved_chunks": { "type": "array", "required": true }
  },
  "outputs": {
    "retrieval_quality": { "type": "object" },
    "abstained": { "type": "boolean" },
    "trace": { "type": "array" }
  },
  "execution": {
    "type": "python",
    "entrypoint": "app.graph.nodes:adequacy_check_agent"
  }
}
